id,nhom_chinh,ma_dich_vu,ten_dich_vu,nhom_dich_vu
83,BCCP,PHBC_DEFAULT,Phát hành báo chí,Phát hành báo chí
84,HCC,Chuyển phát HCC,Chuyển phát HCC,Chuyển phát HCC
85,HCC,"Chi trả lương hưu, bảo hiểm xã hội","Chi trả lương hưu, bảo hiểm xã hội","Chi trả lương hưu, bảo hiểm xã hội"
86,HCC,Chi trả người có công,Chi trả người có công,Chi trả người có công
87,HCC,Chi trả bảo trợ xã hội,Chi trả bảo trợ xã hội,Chi trả bảo trợ xã hội
88,HCC,Quản lý người hưởng,Quản lý người hưởng,Quản lý người hưởng
89,HCC,CSHT,CSHT,CSHT
90,TCBC,Tiết kiệm,Tiết kiệm,Tiết kiệm
91,TCBC,Tín dụng,Tín dụng,Tín dụng
92,TCBC,PTI,PTI,PTI
93,TCBC,Thu tiền điện,Thu tiền điện,Thu tiền điện
94,TCBC,BHXH-BHYT,BHXH-BHYT,BHXH-BHYT
95,TCBC,Dịch vụ chuyển tiền,Dịch vụ chuyển tiền,Dịch vụ chuyển tiền
96,PPBL,Hàng bán sỉ,Hàng bán sỉ,Hàng bán sỉ
97,PPBL,Hàng tiêu dùng bán lẻ,Hàng tiêu dùng bán lẻ,Hàng tiêu dùng bán lẻ
441,BCCP,CTN001,Chuyển phát tiêu chuẩn,Truyền thống
442,BCCP,CTN012,Chuyển phát Quà tặng Tiêu chuẩn,Truyền thống
443,BCCP,CTN015,Chuyển phát Nông sản,Truyền thống
444,BCCP,CTN016,Chuyển phát Tiêu chuẩn đồng giá,Truyền thống
445,BCCP,ETN001,EMS Premium Tài liệu,Truyền thống
446,BCCP,ETN003,EMS hỏa tốc,Truyền thống
447,BCCP,ETN011,EMS Premium Hàng hóa,Truyền thống
448,BCCP,ETN013,EMS hỏa tốc,Truyền thống
449,BCCP,ETN029,EMS Thư đồng giá,Truyền thống
450,BCCP,ETN030,EMS HSXT,Truyền thống
451,BCCP,ETN034,EMS tài chính ngân hàng gói tiêu chuẩn,Truyền thống
452,BCCP,ETN036,EMS tài chính ngân hàng gói vàng,Truyền thống
453,BCCP,ETN039,EMS chuyên tuyến,Truyền thống
454,BCCP,ETN044,EMS Last Mile Premium,Truyền thống
455,BCCP,ETN045,EMS Lastmile Standard A,Truyền thống
456,BCCP,ETN047,Chuyển phát nhanh EMS Quà Tặng,Truyền thống
457,BCCP,ETN049,EMS Tài liệu – Gói ưu đãi,Truyền thống
458,BCCP,ETN050,EMS Hàng hoá nhanh – Gói ưu đãi,Truyền thống
459,BCCP,KT1001,KT1,Truyền thống
460,BCCP,KT1002,KT1 Hỏa tốc,Truyền thống
461,BCCP,KT1003,KT1 Hẹn giờ,Truyền thống
462,BCCP,KT1004,KT1 Hỏa tốc Hẹn giờ,Truyền thống
463,BCCP,KT1005,KTI A,Truyền thống
464,BCCP,KT1006,KT1 B,Truyền thống
465,BCCP,KT1007,KTI C,Truyền thống
466,BCCP,KT1008,KT1 Hỏa tốc - A,Truyền thống
467,BCCP,KT1009,KT1 Hỏa tốc - B,Truyền thống
468,BCCP,KT1010,KT1 Hỏa tốc - C,Truyền thống
469,BCCP,KT1011,KT1 Hỏa tốc Hẹn giờ - A,Truyền thống
470,BCCP,KT1012,KT1 Hỏa tốc Hẹn giờ - B,Truyền thống
471,BCCP,KT1013,KT1 Hỏa tốc Hẹn giờ - C,Truyền thống
472,BCCP,KT1014,KT1 Hẹn giờ - A,Truyền thống
473,BCCP,KT1015,KT1 Hẹn giờ - B,Truyền thống
474,BCCP,KT1016,KT1 Hẹn giờ - C,Truyền thống
475,BCCP,RTN001,Bưu phẩm bảo đảm,Truyền thống
476,BCCP,RTN004,Bưu phẩm bảo đảm đồng giá,Truyền thống
477,BCCP,TTN001,Bưu phẩm thường - Thư,Truyền thống
478,BCCP,TTN003,Bưu phẩm thường - Ấn phẩm,Truyền thống
479,BCCP,TTN006,Bưu phẩm KĐC,Truyền thống
480,BCCP,CTN007,Chuyển phát Tiêu chuẩn Thương mại điện tử,TMĐT
481,BCCP,CTN008,Tiêu chuẩn sàn Thương mại điện tử,TMĐT
482,BCCP,CTN009,Chuyển phát Tiêu chuẩn TMĐT đồng giá - gói Cơ bản,TMĐT
483,BCCP,CTN019,Chuyển phát Tiêu chuẩn TMĐT đồng giá - Gói Bạc,TMĐT
484,BCCP,CTN020,Chuyển phát Tiêu chuẩn TMĐT đồng giá - Gói Vàng,TMĐT
485,BCCP,CTN022,Chuyển phát Tiêu chuẩn TMĐT đồng giá - Gói Kim Cương,TMĐT
486,BCCP,ETN031,Chuyển phát nhanh EMS Thương mại điện tử,TMĐT
487,BCCP,ETN037,Chuyển phát nhanh EMS Thương mại điện tử đồng giá,TMĐT
488,BCCP,ETN048,EMS Thương mại điện tử Eco,TMĐT
489,BCCP,ETN051,EMS Thương mại điện tử Eco Plus,TMĐT
490,BCCP,CQT002,Bưu kiện thủy bộ,Quốc tế
491,BCCP,CQT003,Bưu kiện máy bay,Quốc tế
492,BCCP,CQT004,Bưu kiện chuyên tuyến,Quốc tế
493,BCCP,CQT007,Bưu kiện bay - Gói Đồng,Quốc tế
494,BCCP,CQT008,Bưu kiện máy bay - Gói Bạc,Quốc tế
495,BCCP,CQT009,Bưu kiện máy bay - Gói Vàng,Quốc tế
496,BCCP,CQT010,Bưu kiện máy bay - Gói Kim Cương,Quốc tế
497,BCCP,DHL001,DHL Tài liệu zone10,Quốc tế
498,BCCP,DHL002,DHL Hàng hoá zone10,Quốc tế
499,BCCP,EQT001,EMS tài liệu quốc tế,Quốc tế
500,BCCP,EQT002,EMS hàng hóa quốc tế,Quốc tế
501,BCCP,EQT003,CPN Chuyên tuyến đi Mỹ,Quốc tế
502,BCCP,LQT004,Gói nhỏ Epacket,Quốc tế
503,BCCP,LQT005,Gói nhỏ Asean Pack,Quốc tế
504,BCCP,PRM004,Gói nhỏ Prime Tracked,Quốc tế
505,BCCP,RQT001,Tài liệu bảo đảm đi quốc tế,Quốc tế
506,BCCP,RQT003,Ân phẩm bảo đảm,Quốc tế
507,BCCP,RQT006,Gói nhỏ đảm bảo,Quốc tế
508,BCCP,RQT008,Gói nhỏ đảm bảo - Gói bạc,Quốc tế
509,BCCP,RQT009,Gói nhỏ bảo đảm - Gói vàng,Quốc tế
510,BCCP,RQT010,Gói nhỏ bảo đảm - Gói kim cương,Quốc tế
511,BCCP,RQT011,Gói nhỏ đảm bảo - Gói đồng,Quốc tế
512,BCCP,TQT001,Tài liệu cơ bản đi quốc tế,Quốc tế
513,BCCP,TQT007,Thư công ích đi Quốc tế,Quốc tế
514,BCCP,UPS002,UPS Tài liệu,Quốc tế
515,BCCP,CTN024,Chuển phát Tiêu chuẩn - Giá trị cao,Truyền thống
516,BCCP,CTN028,Chuyển phát Tiêu chuẩn TMĐT đồng giá - Gói Bạch Kim,TMĐT
517,BCCP,CTN031,Chuyển phát Tiêu chuẩn TMĐT 48h - Gói Pro,TMĐT
518,HCC,HCC001,Hành chính công EMS,Hành chính công
519,HCC,HCC002,Hành chính công EMS có VAT,Hành chính công
520,HCC,HCC003,Hành chính công BPBĐ,Hành chính công
521,HCC,HCC004,Hành chính công BPBĐ có VAT,Hành chính công
522,BCCP,ETN043,EMS Siêu tốc Hà Nội - HCM,Truyền thống
